{"_meta": {"api_version": "1", "contract_version": "1.14", "generated_at": "2026-07-22T01:57:35+00:00", "provenance": "socrata", "data_tier": "mixed", "tier_note": "matter records (title/status/sponsors/dates) are real (Legistar + Councilmatic); topic-relevance tagging is derived (keyword net + classifier, best-effort).", "license": "City of Chicago Data Portal Terms of Use (data.cityofchicago.org); derived analyses by On Your Left!", "attribution": "On Your Left! \u2014 Chicago bike safety, on the record (https://github.com/jartinator/chicago-safe-streets-data)", "human_page": "https://jartinator.github.io/chicago-safe-streets-data/action.html", "methodology": "https://jartinator.github.io/chicago-safe-streets-data/methodology.html", "schema": "https://jartinator.github.io/chicago-safe-streets-data/api/v1/schemas/council-records.schema.json"}, "as_of": "2026-07-22T01:57:35+00:00", "note": "Merged from two sources: the Legistar Web API (historical, through 2023-06-21) and DataMade's Chicago Councilmatic mirror (current through 2026-07-15), which covers the period after Chicago's council left Legistar. Each record carries a `source`. recorded_votes appears only on the rare bills with a recorded roll-call split \u2014 most council actions pass by voice vote. sponsor_wards resolves only when a sponsor's name exactly matches a manually-filled entry in aldermen.json; empty means unresolved, not 'no sponsors'. topic_relevant/topic_reason are automated tags (topic_tag_tier: derived) \u2014 see topic_tagged_by ('llm' vs 'keyword_fallback').", "count": 223, "records": [{"matter_id": "R2026-0027162", "title": "Amendment of members of Committee on Ethics and Oversight by removing Alderperson Sposato and members of Committee on Pedestrian and Traffic Safety by removing Alderperson Robinson for 2023-2027 term", "type": "resolution", "status": "Introduced", "intro_date": "2026-07-15", "sponsors": ["Harris, Michelle A."], "sponsor_wards": ["8"], "url": "https://chicago.councilmatic.org/legislation/R2026-0027162/", "source": "councilmatic"}, {"matter_id": "R2026-0026846", "title": "Removal of Alder Sposato as member of Committee on Ethics and Government Oversight and Alder Robinson as member of Committee on Pedestrian and Traffic Safety for term 2023-2027", "type": "resolution", "status": "Introduced", "intro_date": "2026-07-09", "sponsors": ["Harris, Michelle A.", "Johnson, Brandon"], "sponsor_wards": ["8"], "url": "https://chicago.councilmatic.org/legislation/R2026-0026846/", "source": "councilmatic"}, {"matter_id": "O2025-0018220", "title": "Acceptance of negotiated permanent easement from Union Pacific Railroad to facilitate Illinois Commerce Commission project for installation of pedestrian safety facilities at N Nagle Ave and W Somerset Ave highway-rail grade crossing", "type": "ordinance", "status": "Passed", "intro_date": "2025-06-18", "sponsors": ["Johnson, Brandon"], "sponsor_wards": [], "url": "https://chicago.councilmatic.org/legislation/O2025-0018220/", "source": "councilmatic"}, {"matter_id": "O2025-0015717", "title": "Amendment of Annual Appropriation Ordinance to transfer funds within Committee on Pedestrian and Traffic Safety for Year 2025", "type": "ordinance", "status": "Passed", "intro_date": "2025-02-26", "sponsors": ["La Spata, Daniel"], "sponsor_wards": ["1"], "url": "https://chicago.councilmatic.org/legislation/O2025-0015717/", "source": "councilmatic"}, {"matter_id": "O2025-0015514", "title": "Amendment of Municipal Code Section 9-52-020 prohibiting operation of bicycles, scooters, or low-speed electric mobility devices on any sidewalk", "type": "ordinance", "status": "Introduced", "intro_date": "2025-02-19", "sponsors": ["Hopkins, Brian"], "sponsor_wards": ["2"], "url": "https://chicago.councilmatic.org/legislation/O2025-0015514/", "source": "councilmatic"}, {"matter_id": "O2025-0015530", "title": "Amendment of Municipal Code Chapter 9-52 by modifying Sections 9-52-120 and 9-52-130 prohibiting parking of low-speed electric bicycles or electric mobility devices on public way", "type": "ordinance", "status": "Introduced", "intro_date": "2025-02-19", "sponsors": ["Hopkins, Brian"], "sponsor_wards": ["2"], "url": "https://chicago.councilmatic.org/legislation/O2025-0015530/", "source": "councilmatic"}, {"matter_id": "SO2024-0014243", "title": "Transfer of funds within Committee on Pedestrian and Traffic Safety for year 2024", "type": "ordinance", "status": "Substituted", "intro_date": "2024-12-02", "sponsors": ["La Spata, Daniel"], "sponsor_wards": ["1"], "url": "https://chicago.councilmatic.org/legislation/SO2024-0014243/", "source": "councilmatic"}, {"matter_id": "R2024-0013173", "title": "Congratulations extended to Paul Weise on retirement from Beverly Bike and Ski", "type": "resolution", "status": "Introduced", "intro_date": "2024-10-22", "sponsors": ["O'Shea, Matthew J."], "sponsor_wards": ["19"], "url": "https://chicago.councilmatic.org/legislation/R2024-0013173/", "source": "councilmatic"}, {"matter_id": "SO2024-0012284", "title": "Transfer of funds within Committee on Pedestrian and Traffic Safety for Year 2024", "type": "ordinance", "status": "Passed", "intro_date": "2024-09-18", "sponsors": ["La Spata, Daniel"], "sponsor_wards": ["1"], "url": "https://chicago.councilmatic.org/legislation/SO2024-0012284/", "source": "councilmatic"}, {"matter_id": "R2024-0009627", "title": "Call for hearing(s) on benefits from bus infrastructure improvements on mobility and traffic safety", "type": "resolution", "status": "Introduced", "intro_date": "2024-05-22", "sponsors": ["La Spata, Daniel"], "sponsor_wards": ["1"], "url": "https://chicago.councilmatic.org/legislation/R2024-0009627/", "source": "councilmatic"}, {"matter_id": "F2024-0009726", "title": "Rule 41 Failure to Report Response to request from Alderperson Lopez regarding matter pending in Committee on Pedestrian and Traffic Safety", "type": "bill", "status": "Introduced", "intro_date": "2024-05-22", "sponsors": ["La Spata, Daniel"], "sponsor_wards": ["1"], "url": "https://chicago.councilmatic.org/legislation/F2024-0009726/", "source": "councilmatic"}, {"matter_id": "SO2024-0007754", "title": "Amendment of Municipal Code Titles 2 and 4 by adding new Section 2-36-520 and new Chapter 4-24 regarding lithium-ion battery safety certifications, including lithium battery re-use standards or prohibitions for electric bicycles and other mobility devices", "type": "ordinance", "status": "Passed", "intro_date": "2024-02-21", "sponsors": ["Silverstein, Debra L.", "Gardiner, James M."], "sponsor_wards": ["45", "50"], "url": "https://chicago.councilmatic.org/legislation/SO2024-0007754/", "source": "councilmatic"}, {"matter_id": "O2023-0006084", "title": "Traffic direction at N/S Lavergne St from W Gladys Ave to W Fulton St - One-Way southerly except bicycles - amend", "type": "ordinance", "status": "Introduced", "intro_date": "2023-12-13", "sponsors": ["Ervin, Jason C."], "sponsor_wards": ["28"], "url": "https://chicago.councilmatic.org/legislation/O2023-0006084/", "source": "councilmatic"}, {"matter_id": "O2023-0006076", "title": "Traffic direction at S/N Keeler Ave from W Congress Pkwy to W Washington Blvd, and from W West End Ave to W Lake St - One-Way southerly except for bicycles - amend", "type": "ordinance", "status": "Introduced", "intro_date": "2023-12-13", "sponsors": ["Ervin, Jason C."], "sponsor_wards": ["28"], "url": "https://chicago.councilmatic.org/legislation/O2023-0006076/", "source": "councilmatic"}, {"matter_id": "O2023-0003275", "title": "Traffic direction at N Leavitt St from W Ainslie St to W Foster Ave - One-Way northerly except for bicycles - amend", "type": "ordinance", "status": "Introduced", "intro_date": "2023-09-14", "sponsors": ["Vasquez, Jr., Andre"], "sponsor_wards": ["40"], "url": "https://chicago.councilmatic.org/legislation/O2023-0003275/", "source": "councilmatic"}, {"matter_id": "O2023-0003276", "title": "Traffic direction at W Leland Ave from N Rockwell St to N Western Ave - One-Way easterly except for bicycles - amend", "type": "ordinance", "status": "Introduced", "intro_date": "2023-09-14", "sponsors": ["Vasquez, Jr., Andre"], "sponsor_wards": ["40"], "url": "https://chicago.councilmatic.org/legislation/O2023-0003276/", "source": "councilmatic"}, {"matter_id": 170659, "title": "Call for Committee on Pedestrian and Traffic Safety to hold hearing on traffic safety and pedestrian safety impacts of street closures for NASCAR Cup Series Grant Park 220 and NASCAR Xfinity Series The Loop 121 Chicago Street Race", "type": "Resolution", "status": "Introduced", "intro_date": "2023-05-31T00:00:00", "sponsors": ["Conway, William", "Reilly, Brendan", "Vasquez, Jr., Andre", "Cruz, Ruth", "Robinson, Lamont J. ", "La Spata, Daniel "], "sponsor_wards": ["1", "30", "34", "4", "40", "42"], "url": "https://chicago.legistar.com/LegislationDetail.aspx?ID=170659", "source": "legistar"}, {"matter_id": 168551, "title": "Amendment of Municipal Code Section 9-52-010 regarding bicyclists rights on city roadways", "type": "Ordinance", "status": "Failed to Pass", "intro_date": "2023-03-15T00:00:00", "sponsors": ["Hadden, Maria E. ", "Silverstein, Debra L.", "Osterman, Harry", "Martin, Matthew J. ", "Cappleman, James", "Gardiner, James M. ", "Knudsen, Timothy R.", "Reilly, Brendan", "Napolitano, Anthony V.", "Nugent, Samantha ", "Sposato, Nicholas", "Villegas, Gilbert", "Ramirez-Rosa, Carlos", "Rodriguez Sanchez, Rossana ", "Waguespack, Scott", "Cardona, Jr., Felix ", "Reboyras, Ariel", "Taliaferro, Chris", "Burnett, Jr., Walter", "Maldonado, Roberto", "Sigcho-Lopez, Byron", "Scott, Monique L. ", "Tabares, Silvana", "Rodriguez, Michael D.", "Brookins, Jr., Howard", "Taylor, Jeanette B. ", "O'Shea, Matthew J.", "Curtis, Derrick G.", "Coleman, Stephanie D. ", "Lopez, Raymond A.", "Burke, Edward M.", "Quinn, Marty", "Abarca, Anabel ", "Lee, Nicole T. ", "Sadlowski Garza, Susan", "Beale, Anthony", "Sawyer, Roderick T.", "Hairston, Leslie A.", "King, Sophia D."